{
  "name": "zai-coding-plan",
  "engine": "anthropic",
  "display_name": "Z.AI Coding Plan",
  "description": "Z.AI Coding Plan (Anthropic Messages endpoint)",
  "api_key_env": "ZHIPU_API_KEY",
  "base_url": "https://api.z.ai/api/anthropic",
  "models": [
    {
      "name": "<model-id>",
      "context_limit": 1000000
    }
  ],
  "supports_streaming": true,
  "requires_auth": true
}
